{
  "allow_assistance": true,
  "allow_push": true,
  "allow_resolve": true,
  "allows_costly_success": true,
  "alternate_evidence_sources": [],
  "approaches": [
    {
      "facet": "cunning",
      "id": "tech",
      "label": "Work the controller",
      "skill": "technology"
    }
  ],
  "clock_cost": 1,
  "consumable_substitutes": [
    "item.scrap_wire"
  ],
  "costly_options": [
    {
      "effects": [
        {
          "label": "You leave a trace in the grid",
          "op": "world.mark_trace",
          "params": {
            "label": "A trace in the market grid",
            "trace_id": "fact.grid_trace"
          }
        }
      ],
      "id": "trace",
      "label": "Leave a trace in the market grid"
    }
  ],
  "default_benefit_id": "silent",
  "description": "Splice into the service door's controller and open it.",
  "difficulty": {
    "defender_id": "",
    "defense_facet": "",
    "defense_modifiers": [],
    "defense_skill": "",
    "kind": "fixed",
    "target": 13
  },
  "display_name": "Bypass the service door controller",
  "failure_effects": [
    {
      "label": "The patrol advances",
      "op": "world.counter_add",
      "params": {
        "amount": 1,
        "counter_id": "patrol"
      }
    },
    {
      "label": "The controller locks down",
      "op": "object.set_flag",
      "params": {
        "key": "locked",
        "object_id": "controller",
        "value": true
      }
    }
  ],
  "fear": false,
  "id": "nm.bypass_controller",
  "lesser_concessions": [],
  "modifiers": [],
  "objective_id": "nm.objective.bypass_controller",
  "relationship": {},
  "required_tools": [
    "tool.signal_kit"
  ],
  "requirements": [
    {
      "label": "At the market gate",
      "op": "require.scene",
      "params": {
        "scene_id": "nm.gate"
      }
    },
    {
      "label": "Still outside the market hall",
      "op": "require.actor_zone",
      "params": {
        "zone_id": "street"
      }
    },
    {
      "label": "The controller is reachable and not locked down",
      "op": "require.accessible_controller",
      "params": {
        "object_id": "controller"
      }
    },
    {
      "label": "The service door is still closed",
      "op": "require.object_flag",
      "params": {
        "key": "open",
        "object_id": "service_door",
        "value": false
      }
    }
  ],
  "retry_policy": "lock_until_change",
  "revealable_facts": [],
  "routine_requirements": [],
  "stakes": {
    "failure": "The patrol advances and the controller locks down.",
    "success": "The service door opens."
  },
  "strong_benefits": [
    {
      "effects": [
        {
          "label": "Nobody noticed you",
          "op": "actor.flag",
          "params": {
            "key": "silent_entry",
            "value": true
          }
        }
      ],
      "id": "silent",
      "label": "Silent entry",
      "requires_consent": false
    },
    {
      "effects": [
        {
          "label": "You copy the access log",
          "op": "fact.reveal",
          "params": {
            "fact_id": "fact.access_log"
          }
        }
      ],
      "id": "log",
      "label": "Copy the access log",
      "requires_consent": false
    }
  ],
  "success_effects": [
    {
      "label": "The service door opens",
      "op": "object.set_flag",
      "params": {
        "key": "open",
        "object_id": "service_door",
        "value": true
      }
    },
    {
      "label": "You step into the market hall",
      "op": "actor.zone",
      "params": {
        "zone_id": "hall"
      }
    }
  ],
  "tags": [
    "technical",
    "route"
  ],
  "useful_tools": [],
  "version": 1
}
